{
  "schema_version": 1,
  "report_id": "rpt-multi-turn-001",
  "generated_at": "2026-06-24T12:20:00Z",
  "runner": {
    "name": "agentclash-evals",
    "version": "0.1.0",
    "language": "python"
  },
  "summary": {
    "total": 1,
    "passed": 1,
    "failed": 0,
    "skipped": 0,
    "errored": 0,
    "metric_failures": 0,
    "duration_ms": 3200.0,
    "total_cost_usd": 0.003
  },
  "cases": [
    {
      "case": {
        "case_id": "test_multi_turn_refund",
        "name": "test_multi_turn_refund",
        "file": "tests/test_multi_turn.py",
        "line": 15,
        "input": "I was double charged on order 9876.",
        "expected": "Agent resolves refund after clarification turn"
      },
      "status": "passed",
      "agent_result": {
        "input": "I was double charged on order 9876.",
        "output": "I've processed a full refund for order 9876. You should see it in 3-5 business days.",
        "messages": [
          {"role": "user", "content": "I was double charged on order 9876."},
          {"role": "assistant", "content": "I see order 9876. Can you confirm the charge amount?"},
          {"role": "user", "content": "It was $49.99 twice."},
          {"role": "assistant", "content": "I've processed a full refund for order 9876. You should see it in 3-5 business days."}
        ],
        "tool_calls": [
          {"name": "lookup_order", "arguments": {"order_id": "9876"}, "turn_index": 0},
          {"name": "issue_refund", "arguments": {"order_id": "9876", "amount_usd": 49.99}, "turn_index": 1}
        ],
        "retrieval_context": [
          {"content": "Refund policy: full refund within 30 days for duplicate charges.", "source": "policy.md", "score": 0.92}
        ],
        "metadata": {
          "model": "gpt-4.1-mini",
          "latency_ms": 3100,
          "cost_usd": 0.003,
          "step_count": 2
        }
      },
      "metrics": [
        {
          "key": "contains_refund",
          "name": "Contains",
          "passed": true,
          "reason": "output contains 'refund'",
          "evidence": {"matched": "refund"}
        },
        {
          "key": "tool_sequence",
          "name": "ToolSequence",
          "passed": true,
          "reason": "tools called in expected order",
          "evidence": {"sequence": ["lookup_order", "issue_refund"]}
        }
      ],
      "duration_ms": 3200.0,
      "cost_usd": 0.003
    }
  ],
  "exit_code": 0,
  "duration_ms": 3200.0,
  "total_cost_usd": 0.003
}
